{
  "enums": {
    "availability": [
      "available",
      "sold_out",
      "waitlist",
      "unavailable"
    ],
    "event_status": [
      "scheduled",
      "cancelled",
      "postponed",
      "rescheduled",
      "moved_online"
    ],
    "event_type": [
      "jam",
      "performance",
      "talk",
      "retreat",
      "other"
    ],
    "focal_point": [
      "center",
      "top",
      "bottom",
      "left",
      "right",
      "top-left",
      "top-right",
      "bottom-left",
      "bottom-right"
    ],
    "journal_hero_variant": [
      "cover",
      "contained"
    ],
    "page_mode": [
      "minimal",
      "full"
    ],
    "pricing_model": [
      "fixed",
      "donation",
      "sliding_scale",
      "free"
    ],
    "schedule_mode": [
      "dates",
      "recurring"
    ],
    "status": [
      "draft",
      "published",
      "unlisted",
      "upcoming",
      "current",
      "past",
      "coming_soon"
    ],
    "status_by_record_type": {
      "event": [
        "draft",
        "upcoming",
        "current",
        "past",
        "unlisted"
      ],
      "fixed_page": [
        "draft",
        "published",
        "unlisted"
      ],
      "journal": [
        "published",
        "coming_soon",
        "unlisted"
      ],
      "legal_page": [
        "draft",
        "published"
      ],
      "site_settings": [
        "published"
      ],
      "venue": [
        "published"
      ],
      "workshop": [
        "draft",
        "upcoming",
        "current",
        "past",
        "unlisted"
      ]
    },
    "weekday": [
      "monday",
      "tuesday",
      "wednesday",
      "thursday",
      "friday",
      "saturday",
      "sunday"
    ]
  },
  "ignored_content_keys": [],
  "record_types": {
    "event": {
      "fields": [
        {
          "allow_empty": false,
          "class": "G",
          "cms_visible": true,
          "enum": "event_type",
          "id": "event.g.global.event_type",
          "nullable": false,
          "path": "global.event_type",
          "required": false,
          "type": "string",
          "v1_downgrade": {
            "path": "de.event_type"
          },
          "v1_source": {
            "path": "de.event_type"
          }
        },
        {
          "allow_empty": false,
          "class": "G",
          "cms_visible": true,
          "id": "event.g.global.id",
          "nullable": false,
          "path": "global.id",
          "required": true,
          "type": "string",
          "v1_downgrade": {
            "path": "de.id"
          },
          "v1_source": {
            "path": "de.id"
          }
        },
        {
          "allow_empty": false,
          "class": "G",
          "cms_visible": true,
          "id": "event.g.global.intended_locales.item",
          "nullable": false,
          "path": "global.intended_locales[]",
          "required": false,
          "type": "string",
          "v1_downgrade": {
            "path": "de.intended_locales[]"
          },
          "v1_source": {
            "path": "de.intended_locales[]"
          }
        },
        {
          "allow_empty": false,
          "class": "G",
          "cms_visible": true,
          "enum": "page_mode",
          "id": "event.g.global.page_mode",
          "nullable": false,
          "path": "global.page_mode",
          "required": false,
          "type": "string",
          "v1_downgrade": {
            "path": "de.page_mode"
          },
          "v1_source": {
            "path": "de.page_mode"
          }
        },
        {
          "allow_empty": false,
          "class": "G",
          "cms_visible": true,
          "enum": "availability",
          "id": "event.g.global.registration.availability",
          "nullable": false,
          "path": "global.registration.availability",
          "required": false,
          "type": "string",
          "v1_downgrade": {
            "path": "de.registration.availability"
          },
          "v1_source": {
            "path": "de.registration.availability"
          }
        },
        {
          "allow_empty": false,
          "class": "G",
          "cms_visible": true,
          "id": "event.g.global.registration.url",
          "nullable": false,
          "path": "global.registration.url",
          "required": false,
          "type": "string",
          "v1_downgrade": {
            "path": "de.registration.url"
          },
          "v1_source": {
            "path": "de.registration.url"
          }
        },
        {
          "allow_empty": false,
          "class": "G",
          "cms_visible": true,
          "id": "event.g.global.route",
          "nullable": false,
          "path": "global.route",
          "required": false,
          "type": "string",
          "v1_downgrade": {
            "path": "de.route"
          },
          "v1_source": {
            "path": "de.route"
          }
        },
        {
          "allow_empty": false,
          "class": "G",
          "cms_visible": true,
          "enum": "event_status",
          "id": "event.g.global.schedule.event_status",
          "nullable": false,
          "path": "global.schedule.event_status",
          "required": false,
          "type": "string",
          "v1_downgrade": {
            "path": "de.schedule.event_status"
          },
          "v1_source": {
            "path": "de.schedule.event_status"
          }
        },
        {
          "allow_empty": false,
          "class": "G",
          "cms_visible": true,
          "id": "event.g.global.schedule.featured_occurrences.item.id",
          "nullable": false,
          "path": "global.schedule.featured_occurrences[].id",
          "required": true,
          "type": "string",
          "v1_downgrade": {
            "path": "de.schedule.featured_occurrences[].id"
          },
          "v1_source": {
            "path": "de.schedule.featured_occurrences[].id"
          }
        },
        {
          "allow_empty": false,
          "class": "G",
          "cms_visible": true,
          "id": "event.g.global.schedule.featured_occurrences.item.teacher",
          "nullable": false,
          "path": "global.schedule.featured_occurrences[].teacher",
          "required": false,
          "type": "string",
          "v1_downgrade": {
            "path": "de.schedule.featured_occurrences[].teacher"
          },
          "v1_source": {
            "path": "de.schedule.featured_occurrences[].teacher"
          }
        },
        {
          "allow_empty": false,
          "class": "G",
          "cms_visible": true,
          "enum": "schedule_mode",
          "id": "event.g.global.schedule.mode",
          "nullable": false,
          "path": "global.schedule.mode",
          "required": false,
          "type": "string",
          "v1_downgrade": {
            "path": "de.schedule.mode"
          },
          "v1_source": {
            "path": "de.schedule.mode"
          }
        },
        {
          "allow_empty": false,
          "class": "G",
          "cms_visible": true,
          "id": "event.g.global.schedule.previous_start_local",
          "nullable": false,
          "path": "global.schedule.previous_start_local",
          "required": false,
          "type": "null",
          "v1_downgrade": {
            "path": "de.schedule.previous_start_local"
          },
          "v1_source": {
            "path": "de.schedule.previous_start_local"
          }
        },
        {
          "allow_empty": false,
          "class": "G",
          "cms_visible": true,
          "id": "event.g.global.schedule.recurrence.anchor",
          "nullable": false,
          "path": "global.schedule.recurrence.anchor",
          "required": true,
          "type": "string",
          "v1_downgrade": {
            "path": "de.schedule.recurrence.anchor"
          },
          "v1_source": {
            "path": "de.schedule.recurrence.anchor"
          }
        },
        {
          "allow_empty": false,
          "class": "G",
          "cms_visible": true,
          "id": "event.g.global.schedule.recurrence.end_time",
          "nullable": false,
          "path": "global.schedule.recurrence.end_time",
          "required": true,
          "type": "string",
          "v1_downgrade": {
            "path": "de.schedule.recurrence.end_time"
          },
          "v1_source": {
            "path": "de.schedule.recurrence.end_time"
          }
        },
        {
          "allow_empty": false,
          "class": "G",
          "cms_visible": true,
          "id": "event.g.global.schedule.recurrence.except.item",
          "nullable": false,
          "path": "global.schedule.recurrence.except[]",
          "required": false,
          "type": "array",
          "v1_downgrade": {
            "path": "de.schedule.recurrence.except[]"
          },
          "v1_source": {
            "path": "de.schedule.recurrence.except[]"
          }
        },
        {
          "allow_empty": false,
          "class": "G",
          "cms_visible": true,
          "id": "event.g.global.schedule.recurrence.horizon_months",
          "nullable": false,
          "path": "global.schedule.recurrence.horizon_months",
          "required": true,
          "type": "integer",
          "v1_downgrade": {
            "path": "de.schedule.recurrence.horizon_months"
          },
          "v1_source": {
            "path": "de.schedule.recurrence.horizon_months"
          }
        },
        {
          "allow_empty": false,
          "class": "G",
          "cms_visible": true,
          "id": "event.g.global.schedule.recurrence.start_time",
          "nullable": false,
          "path": "global.schedule.recurrence.start_time",
          "required": true,
          "type": "string",
          "v1_downgrade": {
            "path": "de.schedule.recurrence.start_time"
          },
          "v1_source": {